date,month,time,desc,type,year,event
2019-11-18,11,13h00,"Déclaration suivie d’un déjeuner avec Mme Mette FREDERIKSEN, Première ministre du Royaume de Danemark.",Déjeuner,2019,True
2019-11-18,11,18h00,Remise collective de décoration.,Cérémonie officielle,2019,True
2019-11-19,11,13h00,Déjeuner avec le Premier Ministre.,Déjeuner,2019,True
2019-11-19,11,16h00,Discours à l’occasion du 102ème Congrès des Maires de France (Parc des expositions - Porte de Versailles).,Discours,2019,True
2019-11-20,11,09h30,"30ème anniversaire de la Convention internationale des droits de l'enfant (UNESCO, Paris).",Cérémonie officielle,2019,True
2019-11-20,11,10h30,Conseil des ministres.,Conseil des ministres,2019,True
2019-11-20,11,19h00,Réception en l’honneur des Maires de France à l’occasion du congrès de l’AMF.,Réception,2019,True
2019-11-21,11,Après-midi,Déplacement dans la Somme.,Voyage officiel,2019,True
2019-11-22,11,Toute la journée,Déplacement dans la Somme.,Voyage officiel,2019,True
2019-11-25,11,10h30,"Entretien avec M. Christophe CASTANER, ministre de l’Intérieur.",Entretien,2019,True
2019-11-25,11,11h30,"Entretien avec M. Jean-Yves LE DRIAN, ministre de l’Europe et des Affaires étrangères.",Entretien,2019,True
2019-11-25,11,13h00,Déjeuner avec le Premier ministre.,Déjeuner,2019,True
2019-11-26,11,10h00,"Entretien avec Mme Frédérique VIDAL, ministre de l'Enseignement supérieur, de la Recherche et de l'Innovation.",Entretien,2019,True
2019-11-26,11,19h00,Forum pour les 80 ans du CNRS à Paris - Palais de la découverte.,Discours,2019,True
2019-11-27,11,08h30,Entretien avec le Premier ministre.,Entretien,2019,True
2019-11-27,11,09h00,Conseil restreint de défense.,Conseil de défense,2019,True
2019-11-27,11,10h00,Conseil des ministres.,Conseil des ministres,2019,True
2019-11-28,11,11h00,"Entretien avec M. Jens STOLTENBERG, secrétaire général de l’OTAN.",Entretien,2019,True
2019-11-28,11,15h30,"Entretien avec M. Cyril CHABANIER, président de la Confédération française des travailleurs chrétiens (CFTC).",Entretien,2019,True
2019-11-29,11,12h30,Entretien avec Son Altesse le Prince Albert II de Monaco suivi d’un déjeuner de travail.,Entretien,2019,True
2019-11-29,11,16h15,"Entretien avec M. Philippe ETIENNE, Ambassadeur de France aux États-Unis.",Entretien,2019,True
2019-11-29,11,17h30,Remise de décoration collective.,Cérémonie officielle,2019,True
2019-12-02,12,15h00,Hommage national aux treize militaires morts pour la France en opération au Mali - Hôtel national des Invalides.,Cérémonie officielle,2019,True
2019-12-03,12,09h30,Assises de l’économie de la mer -  Le Corum à Montpellier.,Discours,2019,True
2019-12-03,12,14h00,"Entretien avec M. Donald TRUMP, Président des Etats-Unis d’Amérique - Winfield House, Résidence de l’ambassadeur des Etats-Unis à Londres.",Entretien,2019,True
2019-12-03,12,15h00,"Réunion de coordination avec le Premier ministre du Royaume-Uni, M. Boris JOHNSON, la Chancelière de la République Fédérale d’Allemagne, Mme Angela MERKEL et le Président de la République de Turquie, M. Recep Tayyip ERDOGAN - 10 Downing street, Londres.",Entretien,2019,True
2019-12-03,12,18h00,"Réception donnée par Sa Majesté la Reine Elisabeth II en l’honneur des chefs d’Etat et de Gouvernement, à l’occasion du 70ème anniversaire de l’Organisation du traité de l’Atlantique nord (OTAN) - Buckingham Palace, Londres.",Réception,2019,True
2019-12-03,12,20h00,"Réception donnée par le Premier ministre britannique, M. Boris JOHNSON en l’honneur des chefs d’Etat et de Gouvernement à l’occasion du 70ème anniversaire de l’Organisation du traité de l’Atlantique nord (OTAN) - 10 Downing street, Londres.",Réception,2019,True
2019-12-03,12,21h00,"Entretien avec la Chancelière de la République fédérale d’Allemagne, Mme Angela MERKEL.",Entretien,2019,True
2019-12-04,12,Toute la journée,Sommet de l’OTAN - Londres.,Voyage officiel,2019,True
2019-12-05,12,09h00,Conseil restreint de défense.,Conseil de défense,2019,True
2019-12-05,12,10h00,Conseil des ministres.,Conseil des ministres,2019,True
2019-12-05,12,13h00,Déjeuner avec le Premier ministre.,Déjeuner,2019,True
2019-12-05,12,15h30,"Entretien avec M. Didier MIGAUD, Premier président de la Cour des Comptes.",Entretien,2019,True
2019-12-06,12,11h00,Cérémonie d'hommage aux sauveteurs de l’hélicoptère Dragon 30. Groupement d'hélicoptères de la Sécurité Civile de Nîmes – Garons.,Cérémonie officielle,2019,True
2019-12-06,12,15h30,"Entretien avec M. François ASSELIN, président de la confédération des petites et moyennes entreprises (CPME).",Entretien,2019,True
2019-12-06,12,16h30,"Entretien avec M. Alain GRISET, président de l’Union des entreprises de proximité (U2P).",Entretien,2019,True
2019-12-06,12,18h45,Remise de décoration individuelle.,Cérémonie officielle,2019,True
2019-12-09,12,11h00,"Prise d’armes, suivie d’une cérémonie collective de remise de décorations à l'Hôtel national des Invalides.",Cérémonie officielle,2019,True
2019-12-09,12,15h00,"Entretien avec M. Volodymyr ZELENSKY, Président d’Ukraine dans le cadre du Sommet au format dit « Normandie ».",Entretien,2019,True
2019-12-09,12,15h35,"Entretien avec M. Vladimir POUTINE, Président de la Fédération de Russie dans le cadre du Sommet au format dit « Normandie ».",Entretien,2019,True
2019-12-09,12,16h00,"Séance plénière de travail format dit « Normandie » avec Mme Angela MERKEL, Chancelière fédérale d’Allemagne, M. Vladimir POUTINE, Président de la Fédération de Russie, M. Volodymyr ZELENSKY, Président d’Ukraine.",Entretien,2019,True
2019-12-10,12,13h00,"Déjeuner avec M. Charles MICHEL, Président du Conseil européen.",Déjeuner,2019,True
2019-12-10,12,15h30,"Entretien avec M. Franck RIESTER, ministre de la Culture.",Entretien,2019,True
2019-12-10,12,18h45,Cérémonie de remise de lettres de créances.,Cérémonie officielle,2019,True
2019-12-11,12,09h00,Conseil restreint de défense.,Conseil de défense,2019,True
2019-12-11,12,10h00,Conseil des ministres.,Conseil des ministres,2019,True
2019-12-12,12,09h00,"Rencontre avec les chercheurs et les étudiants du programme ""Make our Planet great again"".",Rencontre,2019,True
2019-12-12,12,Après-midi,Conseil européen à Bruxelles.,Voyage officiel,2019,True
2019-12-13,12,Matin,Conseil européen à Bruxelles.,Voyage officiel,2019,True
2019-12-16,12,10h30,"Entretien avec M. Christophe CASTANER, ministre de l’Intérieur.",Entretien,2019,True
2019-12-16,12,11h30,Entretien avec le Premier ministre.,Entretien,2019,True
2019-12-18,12,08h30,Entretien avec le Premier ministre.,Entretien,2019,True
2019-12-18,12,09h00,Conseil restreint de défense.,Conseil de défense,2019,True
2019-12-18,12,10h00,Conseil des ministres.,Conseil des ministres,2019,True
2019-12-18,12,13h00,"Déjeuner avec Abhijit BANERJEE, Esther DUFLO et Michael KREMER, prix Nobel d'économie 2019.",Déjeuner,2019,True
2019-12-18,12,15h30,Arbre de Noël de l’Élysée.,Réception,2019,True
2019-12-18,12,18h30,Remise individuelle de décoration.,Cérémonie officielle,2019,True
2019-12-19,12,10h00,"Entretien avec Mme Kristalina GEORGIEVA, Directrice générale du Fonds monétaire international.",Entretien,2019,True
2019-12-19,12,16h00,Noël avec les enfants de la crèche de l’Élysée.,Réception,2019,True
2019-12-20,12,Toute la journée,Déplacement en République de Côte d’Ivoire.,Voyage officiel,2019,True
2019-12-21,12,Toute la journée,Déplacement en République de Côte d’Ivoire.,Voyage officiel,2019,True
2019-12-22,12,Toute la journée,Déplacement en République de Côte d’Ivoire.,Voyage officiel,2019,True
2019-12-31,12,20h00,Vœux 2020 aux Français,Discours,2019,True
2020-01-06,01,10h00,Présentation des vœux du Gouvernement suivis du Conseil des ministres.,Conseil des ministres,2020,True
2020-01-06,01,12h30,Conseil restreint de défense.,Conseil de défense,2020,True
2020-01-06,01,13h30,Déjeuner avec le Premier ministre.,Déjeuner,2020,True
2020-01-07,01,11h00,"Entretien avec M. Bruno LASSERRE, Vice-Président du Conseil d’Etat.",Entretien,2020,True
2020-01-07,01,12h30,"Déjeuner avec M. Andrej PLENKOVIC, Premier ministre de la République de Croatie.",Déjeuner,2020,True
2020-01-07,01,15h30,Réception des maitres boulangers pour l’Épiphanie.,Réception,2020,True
2020-01-09,01,11h00,Entretien avec M. Pierre VIMONT.,Entretien,2020,True
2020-01-09,01,15h30,Présentation des vœux au Conseil constitutionnel.,Rencontre,2020,True
2020-01-09,01,17h30,Présentation des vœux aux Autorités religieuses.,Rencontre,2020,True
2020-01-10,01,13h15,"Entretien avec MM. Xavier BETTEL, Premier Ministre du Luxembourg et Charles MICHEL, Président du Conseil européen.",Entretien,2020,True
2020-01-10,01,16h30,"Entretien avec M. Jacques TOUBON, Défenseur des Droits.",Entretien,2020,True
2020-01-10,01,18h30,Intervention devant les membres de la Convention citoyenne pour le Climat et échanges - Palais d'Iéna,Rencontre,2020,True
2020-01-13,01,10h00,Entretien avec le Premier ministre.,Entretien,2020,True
2020-01-13,01,15h30,"Prise d’armes et cérémonie de dépôt de gerbe en mémoire des sept militaires du 5ème régiment d’hélicoptères de combat (RHC) de Pau morts en opération au Mali - Pau, Pyrénées-Atlantiques.",Cérémonie officielle,2020,True
2020-01-13,01,16h30,Sommet du G5 Sahel à Pau.,Sommet,2020,True
2020-01-14,01,10h00,Table ronde sur l’écologie dans les territoires à l’occasion de la signature du Contrat de Transition Ecologique (CTE) de la communauté d’agglomération de Pau et présentation du bus à haut-niveau de service de Pau.,Entretien,2020,True
2020-01-14,01,12h30,"Visite de l’entreprise Héli-union, Pau.",Rencontre,2020,True
2020-01-15,01,08h30,Entretien avec le Premier ministre.,Entretien,2020,True
2020-01-15,01,09h00,Conseil restreint de défense et de sécurité.,Conseil de défense,2020,True
2020-01-15,01,10h00,Conseil des ministres suivi d’un séminaire gouvernemental.,Conseil des ministres,2020,True
2020-01-15,01,16h00,Présentation des vœux à la presse.,Réception,2020,True
2020-01-15,01,19h30,Entretien suivi d’un dîner avec le roi Abdallah II de Jordanie.,Entretien,2020,True
2020-01-16,01,15h00,"Présentation des vœux aux armées à la base aérienne 123 d’Orléans-Bricy, Loiret.",Rencontre,2020,True
2020-01-17,01,15h30,Remise des prix aux lauréats des prix d’excellence à l’occasion du 150ème anniversaire du concours général agricole. Ministère de l’Agriculture et de l’Alimentation.,Rencontre,2020,True
2020-01-17,01,18h00,Vernissage de la Grande Exposition du Fabriqué en France.,Réception,2020,True
2020-01-19,01,Toute la journée,Déplacement en République fédérale d’Allemagne - Berlin.,Voyage officiel,2020,True
2020-01-19,01,12h30,"Entretien avec Mme Angela MERKEL, Chancelière de la République fédérale d’Allemagne.",Entretien,2020,True
2020-01-19,01,13h30,"Entretien avec M. Boris JOHNSON, Premier ministre du Royaume-Uni de Grande-Bretagne et d’Irlande du Nord.",Entretien,2020,True
2020-01-19,01,14h00,Conférence sur la Libye à Berlin.,Rencontre,2020,True
2020-01-20,01,11h30,Déplacement dans l’entreprise AstraZeneca à Dunkerque.,Voyage officiel,2020,True
2020-01-20,01,15h30,Sommet Choose France - Yvelines.,Sommet,2020,True
2020-01-20,01,20h00,Dîner dans le cadre du Sommet Choose France.,Dîner,2020,True
2020-01-21,01,13h00,Déjeuner avec France Industrie - Palais de l'Élysée.,Déjeuner,2020,True
2020-01-21,01,15h30,Ouverture de l’événement « 500 champions des territoires » en faveur des entreprises de taille intermédiaire (ETI) - Palais de l'Élysée.,Réception,2020,True
2020-01-22,01,Toute la journée,Déplacement en Israël et dans les Territoires palestiniens.,Voyage officiel,2020,True
2020-01-23,01,Toute la journée,Déplacement en Israël et dans les Territoires palestiniens.,Voyage officiel,2020,True
2020-01-24,01,08h30,Entretien avec le Premier ministre.,Entretien,2020,True
2020-01-24,01,09h00,Conseil restreint de défense et de sécurité.,Conseil de défense,2020,True
2020-01-24,01,10h00,Conseil des ministres.,Conseil des ministres,2020,True
2020-01-24,01,18h00,Remise de décorations.,Cérémonie officielle,2020,True
2020-01-26,01,18h00,"Réception d’associations engagées dans le domaine des droits de l’enfant, Palais de l’Elysée.",Réception,2020,True
2020-01-27,01,10h30,Inauguration des murs des noms rénovés du Mémorial de la Shoah à l’occasion du 75ème anniversaire de la libération des camps d’Auschwitz-Birkenau.,Cérémonie officielle,2020,True
2020-01-27,01,16h00,"Remise de décoration individuelle, Palais de l’Elysée.",Cérémonie officielle,2020,True
2020-01-28,01,13h15,Déjeuner avec le Premier ministre,Déjeuner,2020,True
2020-01-29,01,08h30,Entretien avec le Premier ministre,Entretien,2020,True
2020-01-29,01,09h00,Conseil restreint de défense et de sécurité,Conseil de défense,2020,True
2020-01-29,01,10h00,Conseil des ministres,Conseil des ministres,2020,True
2020-01-29,01,13h30,"Déjeuner avec M. Kyriákos MITSOTAKIS, Premier Ministre de la République Hellénique, Palais de l’Elysée.",Déjeuner,2020,True
2020-01-29,01,20h00,"Diner du Conseil de Coordination des organisations arméniennes de France, Paris.",Dîner,2020,True
2020-01-30,01,Toute la journée,Déplacement en Charente,Rencontre,2020,True
2020-01-31,01,17h00,"Entretien avec M. Michel BARNIER, négociateur en chef de l’Union européenne, chargé de la préparation et la conduite des négociations avec le Royaume-Uni",Entretien,2020,True
2020-02-03,02,Toute la journée,Déplacement en République de Pologne,Voyage officiel,2020,True
2020-02-04,02,Toute la journée,Déplacement en République de Pologne,Voyage officiel,2020,True
2020-02-05,02,09h00,Entretien avec le Premier ministre,Entretien,2020,True
2020-02-05,02,10h00,Conseil des ministres,Conseil des ministres,2020,True
2020-02-05,02,13h30,"Déjeuner avec M. Alberto Angel FERNANDEZ, Président de la République argentine, Palais de l'Élysée",Déjeuner,2020,True
2020-02-05,02,16h30,"Entretien avec M. Lucas De MEO, directeur général de Renault",Entretien,2020,True
2020-02-07,02,10h30,"Discours sur la stratégie de défense et de dissuasion devant les stagiaires de la 27ème promotion de l’Ecole de guerre, École militaire",Discours,2020,True
2020-02-07,02,18h00,"Remise de décoration individuelle, Palais de l'Élysée",Cérémonie officielle,2020,True
2020-02-10,02,12h15,"Entretien avec M. Christophe CASTANER, ministre de l’Intérieur",Entretien,2020,True
2020-02-10,02,13h15,Déjeuner avec le Premier ministre,Déjeuner,2020,True
2020-02-11,02,11h30,Discours à l’occasion de la Conférence nationale du handicap,Discours,2020,True
2020-02-11,02,15h00,"Entretien avec Mme Christiane LAMBERT, présidente de la Fédération nationale des exploitants agricoles",Entretien,2020,True
2020-02-11,02,16h00,"Entretien avec M. Samuel VANDAELE, président des Jeunes agriculteurs",Entretien,2020,True
2020-02-11,02,17h00,"Entretien avec M. Nicolas GIROD, porte-parole de la Confédération paysanne",Entretien,2020,True
2020-02-11,02,18h00,"Entretien avec M. Bernard LANNES, président de la Coordination rurale",Entretien,2020,True
2020-02-11,02,19h00,"Entretien avec M. Pierre THOMAS, président du Mouvement de défense des exploitants familiaux",Entretien,2020,True
2020-02-11,02,20h00,Echange avec les députés de la majorité,Rencontre,2020,True
2020-02-12,02,09h00,Conseil restreint de défense et de sécurité,Conseil de défense,2020,True
2020-02-12,02,10h00,Conseil des ministres,Conseil des ministres,2020,True
2020-02-12,02,13h30,Conseil de défense écologique,Conseil de défense,2020,True
2020-02-12,02,16h00,Déplacement en Haute-Savoie,Voyage officiel,2020,True
2020-02-13,02,Toute la journée,Déplacement en Haute-Savoie,Voyage officiel,2020,True
2020-02-14,02,12h00,"Déjeuner avec  Mark RUTTE, Premier ministre néerlandais",Déjeuner,2020,True
2020-02-14,02,Après-midi,Déplacement en République Fédérale d’Allemagne dans le cadre de la Conférence de Munich sur la sécurité,Voyage officiel,2020,True
2020-02-15,02,Toute la journée,Déplacement en République Fédérale d’Allemagne dans le cadre de la Conférence de Munich sur la sécurité,Voyage officiel,2020,True
2020-02-17,02,11h30,"Entretien avec M. Denis RANQUE, Président du conseil d’administration d’Airbus Group et M. René OBERMANN",Entretien,2020,True
2020-02-17,02,13h00,Déjeuner avec le Premier ministre.,Déjeuner,2020,True
2020-02-17,02,19h00,"Entretien avec M. Jean-Yves LE DRIAN, Ministre de l’Europe et des Affaires étrangères.",Entretien,2020,True
2020-02-18,02,Toute la journée,Déplacement à Mulhouse (Haut-Rhin),Voyage officiel,2020,True
2020-02-19,02,09h00,Conseil restreint de défense et de sécurité,Conseil de défense,2020,True
2020-02-19,02,10h00,Conseil des ministres,Conseil des ministres,2020,True
2020-02-20,02,Toute la journée,Conseil européen à Bruxelles,Voyage officiel,2020,True
2020-02-21,02,18h00,Événement en l’honneur des productions agricoles d’Outre-mer en présence de leurs représentants,Réception,2020,True
2020-02-22,02,Toute la journée,Visite au salon international de l’agriculture - Parc des expositions de la porte de Versailles,Rencontre,2020,True
2020-02-24,02,12h00,"Entretien avec M. Maurizio SERRA, Académicien et Mme Hélène CARRERE D’ENCAUSSE, Secrétaire perpétuel de l’Académie française",Entretien,2020,True
2020-02-24,02,13h00,Déjeuner avec le Premier ministre.,Déjeuner,2020,True
2020-02-24,02,20h00,Diner en l’honneur des créateurs de mode,Dîner,2020,True
2020-02-25,02,11h00,"Entretien avec M. Christophe CASTANER, Ministre de l’Intérieur.",Entretien,2020,True
2020-02-25,02,15h30,Réunion de travail avec des présidents d’associations d’éducation populaire,Entretien,2020,True
2020-02-26,02,08h30,Entretien avec le Premier ministre,Entretien,2020,True
2020-02-26,02,09h00,Conseil restreint de défense et de sécurité,Conseil de défense,2020,True
2020-02-26,02,10h00,Conseil des ministres,Conseil des ministres,2020,True
2020-02-26,02,16h00,"Obsèques de Michel CHARASSE, Puy-Guillaume (Puy-de-Dôme)",Cérémonie officielle,2020,True
2020-02-27,02,Toute la journée,Sommet Italie-France à Naples (Italie),Voyage officiel,2020,True
2020-02-27,02,10h00,Visite à l’hôpital de la Pitié-Salpêtrière.,Rencontre,2020,True
2020-02-28,02,11h30,"Hommage national à Jean DANIEL, Cour d’honneur de l’Hôtel des Invalides",Cérémonie officielle,2020,True
2020-02-28,02,16h30,Entretien avec Mme Asia BIBI,Entretien,2020,True
2020-02-28,02,18h00,Cérémonie de remise de décorations collective,Cérémonie officielle,2020,True
2020-02-29,02,10h00,Conseil restreint de défense et de sécurité,Conseil de défense,2020,True
2020-02-29,02,11h00,Conseil des ministres,Conseil des ministres,2020,True
2020-03-02,03,13h00,"Déjeuner avec des personnalités engagées pour l’égalité femmes-hommes en présence de Mme Phumzile MLAMBO-NGCUKA, directrice exécutive d’ONU Femmes",Déjeuner,2020,True
2020-03-02,03,19h00,Cérémonie de remise de décoration,Cérémonie officielle,2020,True
2020-03-03,03,10h00,"Entretien avec M. Jean-Yves LE DRIAN, Ministre de l’Europe et des  Affaires étrangères",Entretien,2020,True
2020-03-03,03,12h00,"Entretien avec le professeur Andrea RICCARDI, fondateur de la  communauté San ’Egidio",Entretien,2020,True
2020-03-03,03,13h00,Déjeuner avec le Premier ministre,Déjeuner,2020,True
2020-03-03,03,16h30,"Entretien avec M. Rafael GROSSI, directeur général de l’Agence  internationale de l’énergie atomique",Entretien,2020,True
2020-03-03,03,17h30,Visite au centre de crise du ministère des Solidarités et de la Santé,Rencontre,2020,True
2020-03-04,03,08h30,Conseil de défense consacré à la situation en Syrie,Conseil de défense,2020,True
2020-03-04,03,09h00,Conseil restreint de défense et de sécurité,Conseil de défense,2020,True
2020-03-04,03,09h30,Conseil de défense consacré au Coronavirus Covid-19.,Conseil de défense,2020,True
2020-03-04,03,11h30,Conseil des ministres,Conseil des ministres,2020,True
2020-03-05,03,16h00,Réunion de travail avec des acteurs de la recherche publique et privée engagés dans la lutte contre le COVID19,Rencontre,2020,True
2020-03-06,03,10h00,"Entretien avec Mme Florence PARLY, Ministre des Armées",Entretien,2020,True
2020-03-06,03,11h00,Rencontre avec les professionnels de l'EHPAD Péan à Paris.,Rencontre,2020,True
2020-03-08,03,18h00,Conseil de défense consacré au suivi de la crise du coronavirus COVID-19,Conseil de défense,2020,True
2020-03-09,03,11h30,Inauguration du Café Joyeux - Avenue des Champs-Elysées.,Rencontre,2020,True
2020-03-09,03,13h30,Déjeuner avec le Premier ministre.,Déjeuner,2020,True
2020-03-09,03,18h00,Remise de décorations.,Cérémonie officielle,2020,True
2020-03-10,03,Matin,Visite aux équipes du SAMU de Paris à l'hôpital Necker.,Rencontre,2020,True
2020-03-10,03,17h00,Visioconférence de coordination européenne sur le Coronavirus Covid-19.,Entretien,2020,True
2020-03-11,03,08h30,Entretien avec le Premier ministre.,Entretien,2020,True
2020-03-11,03,09h00,Conseil restreint de défense et de sécurité nationale.,Conseil de défense,2020,True
2020-03-11,03,10h00,Conseil des ministres.,Conseil des ministres,2020,True
2020-03-11,03,13h00,Déjeuner avec SAR Felipe VI Roi d'Espagne et la Reine d'Espagne.,Déjeuner,2020,True
2020-03-11,03,16h15,Cérémonie pour la première journée nationale d'hommage aux victimes du terrorisme - Trocadéro.,Cérémonie officielle,2020,True
2020-03-12,03,20h00,Adresse aux Français,Discours,2020,True
2020-03-13,03,12h00,"Recherche et coordination sanitaire - Déjeuner de travail avec M. Jean-Michel BLANQUER, ministre de l’Education Nationale et de la Jeunesse, Mme Frédérique VIDAL, ministre de l’Enseignement supérieur, de la Recherche et de l’Innovation, M. Gabriel ATTAL, Secrétaire d’Etat auprès du ministre de l’Education nationale et de la Jeunesse et Mme Jacqueline GOURAULT, ministre de la Cohésion des Territoires et des Relations avec les Collectivités territoriales.",Déjeuner,2020,True
2020-03-13,03,15h30,"Mobilisation économique - Entretien avec le Premier Ministre, Mme Elisabeth BORNE, ministre de la Transition écologique et solidaire, M. Olivier VERAN, ministre des Solidarité et de la Santé, M. Bruno LE MAIRE, ministre de l’Economie et des Finances, Mme Muriel PENICAUD, ministre du Travail, M Gérald DARMANIN, ministre de l’Action et des Comptes publics et Mme Agnès PANNIER-RUNACHER, secrétaire d’Etat auprès du ministre de l’Economie et des Finances.",Entretien,2020,True
2020-03-16,03,10h00,"Conférence téléphonique avec la Chancelière de la République fédérale d’Allemagne, Mme Angela MERKEL, le Président du Conseil européen, M. Charles Michel, et la Présidente de la Commission européenne, Mme Ursula Von der Leyen.",Entretien,2020,True
2020-03-16,03,20h00,Adresse aux Français,Discours,2020,True
2020-03-17,03,10h30,Conseil des ministres.,Conseil des ministres,2020,True
2020-03-17,03,15h00,"Visioconférence  avec M. Recep Tayyip Erdogan, Président de la République de Turquie, Mme Angela MERKEL, Chancelière de la République fédérale d'Allemagne, et M. Boris JOHNSON, Premier ministre du Royaume-Uni de Grande-Bretagne et d’Irlande du Nord, sur la situation en Syrie.",Sommet,2020,True
2020-03-17,03,17h00,Conseil européen extraordinaire par visioconférence.,Sommet,2020,True
2020-03-18,03,15h00,Conseil des ministres.,Conseil des ministres,2020,True
2020-03-19,03,Après-midi,Réunion de la « Task force Économie » face au COVID-19.,Entretien,2020,True
2020-03-20,03,Matin,Réunion au Centre interministériel de crise du Ministère de l'Intérieur.,Entretien,2020,True
2020-03-23,03,Après-midi,Visite d'un centre d’hébergement parisien réquisitionné pour accueillir des sans-abri.,Rencontre,2020,True
2020-03-26,03,Matin,Sommet extraordinaire des chefs d’Etat et de gouvernement du G20 consacré au COVID-19.,Sommet,2020,True
2020-03-31,03,Matin,Visite de l’entreprise Kolmi-Hopen à Saint-Barthélemy-d’Anjou dans le Maine-et-Loire.,Rencontre,2020,True
2020-04-02,04,Toute la journée,Message aux personnes qui vivent avec l'autisme.,Discours,2020,True
2020-04-03,04,Matin,Visite au Centre de crise et de soutien du Ministère de l'Europe et des Affaires étrangères.,Rencontre,2020,True
2020-04-08,04,Après-midi,"Déplacement du Président de la République dans le département de Seine-Saint-Denis. Visite de la Maison de Santé pluridisciplinaire de Pantin, puis du Centre Communal d'Action Sociale de La Courneuve.",Rencontre,2020,True
2020-04-13,04,20h00,Adresse aux Français.,Discours,2020,True
2020-04-15,04,Matin,Message un an après l’incendie de Notre-Dame de Paris à toutes celles et ceux qui l’ont sauvée et qui aident à la reconstruire.,Discours,2020,True
2020-04-16,04,14h30,Visioconférence des chefs d'Etat et de gouvernement du G7,Sommet,2020,True
2020-04-16,04,17h00,Échange avec les acteurs internationaux sur les efforts en cours pour accélérer le développement et l'accès au vaccin et au traitement,Rencontre,2020,True
2020-04-17,04,12h00,"Entretien téléphonique avec Vladimir Poutine, Président de la Fédération de Russie",Entretien,2020,True
2020-04-17,04,16h00,"Entretien téléphonique avec Uhuru Kenyatta, Président de la République du Kenya",Entretien,2020,True
2020-04-17,04,17h00,"Entretien téléphonique avec Charles Michel, Président du Conseil européen",Entretien,2020,True
2020-04-17,04,18h00,"Entretien téléphonique avec Angela Merkel, Chancelière de la République fédérale d’Allemagne",Entretien,2020,True
2020-04-20,04,13h00,Déjeuner avec le Premier ministre.,Déjeuner,2020,True
